id_estudiante,nombre_estudiante,edad,genero,semestre_actual,estado_academico,nota_promedio,asistencia,var_nota,F,var_F,num_obs,score_ciencia,score_num,score_social,observaciones,CS,CS_fuente,Rd
1,Ana Pérez,16,F,2,activo,91.1,96.5,2.6331223544175306,1.0,0.17257892095159946,10,0,0,1,Excelente redacción en ensayos | Participación destacada en debates | Líder natural en trabajos grupales | Respetuoso con el material del aula y mobiliario | Representante estudiantil | Modelo de comportamiento en formación y actos cívicos | Disfruta crear presentaciones visuales para sus exposiciones | Gestiona el tiempo de estudio con apoyo de apps digitales | Solicita retroalimentación extra para mejorar sus textos | Participó voluntariamente en campaña de lectura a niños de primaria,0.5,,0.134
2,Carlos Gómez,17,M,2,activo,65.625,79.3,7.38922827123675,1.0,0.2492872528169811,11,0,0,0,Dificultades en Matemática | Mejoró asistencia | Falta de organización en su espacio de trabajo (mochila desordenada) | Mejoró notablemente en participación tras trabajo con psicólogo | Inició tutorías entre pares | Prefiere aprender con videos cortos antes que libros | Disfruta armar rompecabezas de madera en los recreos | Recuerda fechas y datos históricos sin esfuerzo | Propuso crear un mural gráfico para repasar contenidos | Siente ansiedad cuando el pizarrón está lleno de fórmulas | Demuestra empatía al escuchar a sus compañeros,0.3667,formulario,0.234
3,María López,16,F,2,activo,48.95,65.6,8.554401076508967,1.0,0.24596885702136914,11,0,0,0,Ausencias recurrentes | Constante distracción con el celular durante clases | Aislamiento social durante recreos | Inició terapia externa | Incorporado a grupo de teatro escolar para socialización | Disfruta improvisar monólogos cómicos en clase | Escribe cuentos cortos en su cuaderno personal | Prefiere trabajar de pie antes que sentada | Baila cuando hay música de fondo mientras realiza tareas | Solicita roles de actuación en proyectos escolares | Recuerda líneas de texto después de leerlas dos veces,0.5,,0.276
4,Luis Ramírez,15,M,2,activo,90.175,94.6,2.684963273078015,1.0,0.13843318776399313,11,1,0,0,Excelente desempeño en Ciencias Sociales | Ayuda espontáneamente a compañeros con dificultades | Organizador del club de ciencias | Creador de material didáctico para ayudar a compañeros | Ganador de feria científica regional | Construye maquetas de ciudades con cartón y pegamento | Explica mapas conceptuales mejor que el profesor | Prefiere leer sobre historia de la ciencia antes que ficción | Propuso crear un museo escolar de minerales | Diseña pósters informativos con dibujos claros y colores armoniosos | Siente curiosidad por el funcionamiento de los puentes y rascacielos,0.5,,0.139
5,Sofía Castro,16,F,2,activo,92.95,96.7,2.406010991015813,1.0,0.23925003461946565,11,1,0,0,Representante en olimpiadas de Matemática | Competitiva en exceso | Excelente manejo del tiempo en presentaciones orales | Presión excesiva de familia afecta su desempeño social | Aprendió a delegar en trabajos grupales | Crea infografías complejas para resumir temas de física | Resuelve sudokus de nivel avanzado en sus ratos libres | Prefiere trabajar en silencio antes que con música | Propuso un sistema de puntos para mejorar la puntualidad del curso | Siente satisfacción al terminar problemas largos de matemática | Demuestra autocritica constructiva tras recibir feedback,0.5,,0.133
6,Pedro Mendoza,16,M,2,activo,75.2,83.7,8.877092867475127,1.0,0.22522982490981436,11,1,0,1,Bajo rendimiento en Formación Humana | Conflictos frecuentes con compañeros durante Educación Física | Desinterés por actividades culturales y artísticas de la escuela | Participó en concurso de oratoria | Descubrió talento artístico en taller de pintura extracurriculr | Dibuja historietas de superhéroes en márgenes de cuadernos | Prefiere explicar con dibujos antes que con palabras | Construye figuras 3D con palillos y plastilina | Solicitó incorporarse al taller de arte avanzado | Siente calma al colorear mientras escucha música instrumental | Utiliza el arte para regular emociones tras conflictos,0.5,,0.166
7,Valentina Rojas,17,F,2,activo,91.5,94.8,2.828427124746187,1.0,0.17347513111728688,11,3,0,1,Excelente en proyectos de Ciencias | Muestra curiosidad científica | Líder del comité de reciclaje del aula | Inventó experimento casero que compartió con toda la clase | Creador de blog científico estudiantil con alto impacto | Diseña carteles informativos sobre cuidado del medio ambiente | Prefiere documentales de ciencia antes que series de ficción | Construye filtros de agua con materiales reciclables | Propuso crear un huerto escolar con compostaje | Siente entusiasmo al explicar fenómenos cotidianos | Planifica grabar podcasts divulgativos con compañeros,0.5,,0.138
8,Andrés Silva,16,M,2,activo,90.65,94.0,3.253630450913427,1.0,0.221349785013576,11,0,0,1,Destacado en competencias deportivas | Impaciente en explicaciones | Excelente espíritu deportivo | Lesión deportiva afectó su ánimo en el aula | Capitan del equipo de baloncesto | Diseña jugadas de baloncesto en pizarrón para sus compañeros | Prefiere aprender moviéndose antes que sentado | Siente frustración en clases teóricas largas | Propuso crear un torneo intramural de deportes | Organiza grupos de estudio activos (camina mientras repasa) | Demuestra liderazgo vocal durante partidos,0.5,,0.14
